{
  "schema_version": "r8-liquid-u3-stage4-experiment-policy-v1",
  "document_type": "SMPCC_R8_LIQUID_U3_STAGE4_EXPERIMENT_POLICY_V1",
  "run_id": "u3_c1m_cpu_backend_parity_a_20260811T131411Z_v16",
  "purpose": "backend_parity_short_cpu_repeat_a",
  "parents": {
    "plan": {
      "path": "/home/zrj/scout_ws/docs/实物实验注意事项/对比试验/仿真接入液体/20260810_RTX5080_DualSPHysics_GPU_8小时快速构建方案_Agent执行版.md",
      "sha256": "9a17c2296417b2ea3bc0b65a710e88e287a99abc4cbf6e264857efe06d1bd27d"
    },
    "numerical_contract": {
      "path": "/home/zrj/scout_ws/src/scout_apps/simulation/scout_dualsphysics_liquid/config/target_hosts/liquid_zrj_msi_u2404_u3_stage4_numerical_contract_v1.json",
      "sha256": "7b3d7447485d901cd60402f2a7ddd422c587ffa57ba3e5664130d8cd3abd9cd7"
    },
    "settled_qc": {
      "path": "/home/zrj/scout_liquid_lab/audits/u3_c1m_gpu_viscoart0p3_repeatability_restart_20260811T124800Z_v15.qc_v1.json",
      "sha256": "4703c08e09b33fb16ad68b368dd5e99c2b2c930a3091008fa399241fc58a7fd8"
    },
    "candidate_evidence": {
      "path": "/home/zrj/scout_liquid_lab/audits/u3_source_cpu_build_20260807T023724Z_cpu_build.json",
      "sha256": "d407233107d4bc9eeea81b0c5a95cbfc98ad6529f1cb7494b68ae5ecc4b1d604"
    },
    "runner": {
      "path": "/home/zrj/scout_ws/src/scout_apps/simulation/scout_dualsphysics_liquid/scripts/r8_liquid_u3_stage4_experiment_runner_v1.py",
      "sha256": "283ab03508c34142fa3fa19e687d571979ee8eec9e3f21c187689fe93d2e38ce"
    },
    "schema": {
      "path": "/home/zrj/scout_ws/src/scout_apps/simulation/scout_dualsphysics_liquid/schema/target_host_u3_stage4_experiment_policy_v1.json",
      "sha256": "e99ef470bfc71afd6f88c140f233000d5a0d9cc87dfed91c3ab82c17e57c8828"
    },
    "tests": {
      "path": "/home/zrj/scout_ws/src/scout_apps/simulation/scout_dualsphysics_liquid/tests/test_u3_stage4_experiment_runner_v1.py",
      "sha256": "e76ac34c075de30a62d7094d525e62e6fee50f4e75b07d6410b939cb7f842457"
    }
  },
  "tools": {
    "bwrap": {
      "path": "/usr/bin/bwrap",
      "sha256": "52231e1caf55bcbc667b269f49c63599a6f7db4767ae6a039580d0ff853db712"
    },
    "nvidia_smi": {
      "path": "/usr/bin/nvidia-smi",
      "sha256": "22964713c1701fb62b4dd10b26b0dd25d174e100af5bda20c65e0b0fcc32b3be"
    },
    "python": {
      "path": "/usr/bin/python3.12",
      "sha256": "1643dacd9feaedc58f3cc581e4d22577dfe25c09b10282936186ccf0f2e61118"
    }
  },
  "backend": {
    "kind": "CPU",
    "index": null,
    "parallel_jobs": 1
  },
  "gpu": null,
  "inputs": {
    "candidate": {
      "path": "/home/zrj/scout_liquid_lab/build/u3_source_cpu_build_20260807T011031Z.partial/output/artifacts/DualSPHysics5.4CPU_linux64",
      "sha256": "5aa464a8f37b0185bac863987f0d1079a0f1a3d6daead6581562c832278ea202",
      "size_bytes": 32649520,
      "mode": "0755",
      "inode": 14954809,
      "nlink": 1
    },
    "dsph_config": {
      "path": "/home/zrj/scout_liquid_lab/dependency/runtime/u3_c1m_gencase_seed_v3_20260808T150802Z.partial/input/DsphConfig.xml",
      "sha256": "0644c9a6a6687678950fc8966e352b4bbd3de9d3cb787db9e507c2eb7ccaddcd",
      "size_bytes": 293,
      "mode": "0400",
      "inode": 14944233,
      "nlink": 1
    },
    "case_bi4": {
      "path": "/home/zrj/scout_liquid_lab/cases/u3_c1m_gencase_v8_20260808T153753Z.partial/output/C1M_zero.bi4",
      "sha256": "b463ddfe548b3db78b02f23b075dadbdd3c71ea766eb092701b56978ddb3a8e7",
      "size_bytes": 400842,
      "mode": "0440",
      "inode": 14944257,
      "nlink": 1
    },
    "case_xml": {
      "path": "/home/zrj/scout_liquid_lab/cases/u3_c1m_gencase_v8_20260808T153753Z.partial/output/C1M_zero.xml",
      "sha256": "28205c2234dda565da600947d03481c492c6bb493b2e058bd04cd360b7862acb",
      "size_bytes": 7800,
      "mode": "0440",
      "inode": 14944258,
      "nlink": 1
    },
    "restart_part": null,
    "restart_head": null
  },
  "restart": {
    "enabled": false,
    "part_index": null,
    "part_first": null,
    "guest_dir": null
  },
  "solver": {
    "argv": [
      "/runtime/candidate",
      "/case/C1M_case",
      "/output",
      "-cpu",
      "-ompthreads:1",
      "-stable:1",
      "-vres:0",
      "-cellmode:full",
      "-cfl:0.1",
      "-shifting:none",
      "-viscoart:0.3",
      "-tmax:0.25",
      "-tout:0.05",
      "-sv:binx,info",
      "-svres:1",
      "-svtimers:0",
      "-svdomainvtk:0",
      "-saveposdouble:1",
      "-nortimes:1",
      "-createdirs:1",
      "-csvsep:0"
    ],
    "environment": {
      "HOME": "/nonexistent",
      "PATH": "/usr/bin",
      "LC_ALL": "C",
      "LANG": "C",
      "TZ": "UTC0",
      "TMPDIR": "/tmp",
      "OMP_NUM_THREADS": "1",
      "OMP_DYNAMIC": "FALSE",
      "CUDA_VISIBLE_DEVICES": ""
    },
    "expected_particles": 9078,
    "expected_moving": 2669,
    "expected_fluid": 6409
  },
  "sandbox": {
    "model": "ROOTLESS_UID1000_CAP0_BWRAP_NETNS_ONE_FRESH_LAB_OUTPUT_BIND",
    "network": false,
    "guest_uid": 1000,
    "guest_gid": 1000,
    "guest_cap_eff": "0000000000000000",
    "host_write_bind_count": 1,
    "project_workspace_write_bind_count": 0,
    "sudo_used": false,
    "apparmor_profile_used": false,
    "preserve_stage": true
  },
  "run": {
    "attempt_root": "/home/zrj/scout_liquid_lab/stage4_experiments/u3_c1m_cpu_backend_parity_a_20260811T131411Z_v16.partial",
    "output_root": "/home/zrj/scout_liquid_lab/stage4_experiments/u3_c1m_cpu_backend_parity_a_20260811T131411Z_v16.partial/output",
    "stage_root": "/home/zrj/scout_liquid_lab/stage4_experiments/u3_c1m_cpu_backend_parity_a_20260811T131411Z_v16.partial/staging",
    "guest_output_root": "/home/zrj/scout_liquid_lab/stage4_experiments/u3_c1m_cpu_backend_parity_a_20260811T131411Z_v16.partial/staging/guest-output",
    "start_receipt": "/home/zrj/scout_liquid_lab/audits/u3_c1m_cpu_backend_parity_a_20260811T131411Z_v16.start.json",
    "final_receipt": "/home/zrj/scout_liquid_lab/audits/u3_c1m_cpu_backend_parity_a_20260811T131411Z_v16.final.json",
    "failure_receipt": "/home/zrj/scout_liquid_lab/audits/u3_c1m_cpu_backend_parity_a_20260811T131411Z_v16.failure.json",
    "stdout_log": "/home/zrj/scout_liquid_lab/audits/u3_c1m_cpu_backend_parity_a_20260811T131411Z_v16.stdout.log",
    "stderr_log": "/home/zrj/scout_liquid_lab/audits/u3_c1m_cpu_backend_parity_a_20260811T131411Z_v16.stderr.log",
    "resource_log": "/home/zrj/scout_liquid_lab/audits/u3_c1m_cpu_backend_parity_a_20260811T131411Z_v16.resources.jsonl"
  },
  "expected_output": {
    "start_time_s": 0.0,
    "end_time_s": 0.25,
    "output_period_s": 0.05,
    "part_first": 0,
    "part_last": 5,
    "part_count": 6,
    "maximum_output_bytes": 16777216
  },
  "limits": {
    "wall_timeout_seconds": 900,
    "kill_after_seconds": 10,
    "monitor_interval_seconds": 10,
    "minimum_mem_available_bytes": 4294967296,
    "maximum_output_bytes": 16777216
  },
  "experiment": {
    "family": "BACKEND_PARITY_SHORT",
    "comparison_group": "u3_viscoart0p3_fresh_0p25s",
    "repeat_index": 1,
    "motion_kind": "ZERO",
    "motion_contract": {
      "coordinate_frame": "CASE_XYZ_Z_UP_CONTAINER_BODY",
      "translation_axis": "NONE",
      "translation_amplitude_m": 0.0,
      "yaw_amplitude_deg": 0.0,
      "frequency_hz": 0.0,
      "phase_rad": 0.0,
      "active_duration_s": 0.0,
      "tail_duration_s": 0.0
    }
  }
}
